{"schema_version": 1, "project": "e2e-iletisim", "compliance": "kvkk", "entities": [{"name": "roles", "fields": ["id INT UNSIGNED PK AI", "name VARCHAR(50) UNIQUE NOT NULL (admin|moderator|user)", "rank TINYINT NOT NULL (yetki hiyerarşisi)", "created_at TIMESTAMP DEFAULT CURRENT_TIMESTAMP"]}, {"name": "users", "fields": ["id INT UNSIGNED PK AI", "email VARCHAR(190) UNIQUE NOT NULL", "password_hash VARCHAR(255) NOT NULL (PASSWORD_ARGON2ID)", "role_id INT UNSIGNED NOT NULL FK->roles.id", "created_at TIMESTAMP DEFAULT CURRENT_TIMESTAMP", "last_login_at TIMESTAMP NULL"]}, {"name": "messages", "fields": ["id INT UNSIGNED PK AI", "name VARCHAR(120) NOT NULL", "email VARCHAR(190) NOT NULL", "subject VARCHAR(190) NOT NULL", "body TEXT NOT NULL", "ip_address VARCHAR(45) NULL (KVKK minimum veri)", "user_agent VARCHAR(255) NULL", "is_read TINYINT(1) DEFAULT 0", "created_at TIMESTAMP DEFAULT CURRENT_TIMESTAMP"]}, {"name": "user_consents", "fields": ["id INT UNSIGNED PK AI", "user_id INT UNSIGNED NULL FK->users.id ON DELETE CASCADE", "consent_type VARCHAR(50) NOT NULL (cookie|kvkk_aydinlatma)", "policy_version VARCHAR(20) NOT NULL", "granted_at TIMESTAMP DEFAULT CURRENT_TIMESTAMP", "ip_address VARCHAR(45) NULL"]}, {"name": "anonymization_log", "fields": ["id INT UNSIGNED PK AI", "user_id INT UNSIGNED NULL FK->users.id ON DELETE SET NULL", "action VARCHAR(50) NOT NULL (anonymize|delete_request)", "details TEXT NULL", "performed_at TIMESTAMP DEFAULT CURRENT_TIMESTAMP"]}], "roles": ["Admin", "Moderator", "User"], "module_matrix": [{"module": "rbac", "status": "injected", "evidence": ".factory/project-intent.json:notes — RBAC (role_id) + SQL (FK/seed) + hashing zorunlu", "justification": "Intent RBAC'ı zorunlu kılıyor; users tablosu rol katmanı olmadan tanımlanamayacağından §3 gereği Admin/Moderator/User hiyerarşisi users.role_id FK + roles seed ile enjekte edildi, merkezi core/Auth.php require_role() kapısı P2'de zorunlu."}, {"module": "cart", "status": "missing", "evidence": ".factory/project-intent.json:notes — Katalog yok (sepet kurali tetiklenmemeli)", "justification": "Intent katalog/sipariş akışı tanımlamadığını açıkça belirtiyor; §3 sepet kuralı tetiklenmez, modül kapsam dışı bırakıldı — ileride e-ticaret genişlemesi ayrı onaylı istek gerektirir."}, {"module": "seo", "status": "proposed", "evidence": "docs/WEB-EDITION.md:§4 — SEO dostu frontend zorunlu; §7 paketleme ağacı arama motoru dosyalarını içerir", "justification": "Kurumsal site için sektör standardı; paketleme kontratı arama motoru dosyalarını zaten zorunlu kılıyor — meta/OG etiketleri P2'de önerildi, kullanıcı reddetmedikçe eklenir."}, {"module": "kvkk", "status": "injected", "evidence": ".factory/project-intent.json:compliance=kvkk — legal viewlar + cookie consent + user_consents/anonymization_log zorunlu", "justification": "intent.compliance=kvkk — aydınlatma metinleri, açık rıza çerez banner'ı ve user_consents/anonymization_log tabloları §3 koşullu modül #9 uyarınca zorunlu blok olarak enjekte edildi; qa-gate kvkk kanalı bu bileşenleri denetler."}, {"module": "contact_messages", "status": "present", "evidence": ".factory/project-intent.json:notes — iletisim (contact) formu (POST -> messages) + admin paneli", "justification": "Intent'in çekirdek gereksinimi — iletişim formu messages tablosuna kayıt düşer, admin panelinde rol korumalı listelenir; confirmed_by=user-e2e-field-exercise ile onaylı ve donduruldu."}, {"module": "notification", "status": "proposed", "evidence": "docs/WEB-EDITION.md:§3 — ödeme/bildirim/yorum modülleri sektör standartına göre önerilir", "justification": "Yeni iletişim mesajında e-posta bildirimi sektör standardı; §3 uyarınca önerildi — kullanıcı reddetmedikçe P2'de eklenir, aksi halde kapsam dışı kalır."}, {"module": "payment", "status": "missing", "evidence": ".factory/project-intent.json:notes — minimal kurumsal site, satis/odeme akisi tanimli degil", "justification": "Minimal kurumsal tanıtım sitesi; satış/ödeme akışı yok — ödeme modülü kapsam dışı, e-ticaret genişlemesi için ayrı onaylı istek gerekir."}], "injected_modules": ["rbac — Admin/Moderator/User rol katmanı (users.role_id FK + roles seed admin/moderator/user, merkezi core/Auth.php require_role())", "kvkk — views/legal/{aydinlatma,gizlilik,cerez}.php + views/partials/cookie-consent.php + assets/js/cookie-consent.js + user_consents/anonymization_log şeması (SQL/migrations/schema/iletisim_kvkk.sql)"], "approvals": ["intent onayı: iletişim formu (POST -> messages) + rol korumalı admin paneli (mesaj/kullanıcı listesi) — confirmed_by=user-e2e-field-exercise", "intent onayı: katalog yok — §3 sepet kuralı tetiklenmez, sepet/sipariş modülü kapsam dışı", "intent onayı: compliance=kvkk — KVKK bloğu (legal view + çerez rızası + rıza tabloları) zorunlu", "intent onayı: RBAC (role_id) + SQL (FK/seed) + parola hashing zorunlu"], "edge_cases": ["İletişim formunda boş/eksik alan gönderimi → sunucu tarafı doğrulama, VALIDATION_FAILED hata şeması (422 mantığı)", "Geçersiz e-posta formatı → kayıt düşülmez, alan bazlı hata mesajı htmlspecialchars ile kaçışlanarak basılır", "Aynı oturum/IP'den hızlı tekrarlayan form gönderimi → rate-limit + honeypot alanı ile spam koruması", "Mesaj gövdesinde XSS denemesi → çıktıda htmlspecialchars(ENT_QUOTES, 'UTF-8'); ham girdi asla arayüze basılmaz", "Oturumsuz admin paneli erişimi → 302 login yönlendirmesi; role_id=User hesabı admin rotalarında 403 alır", "Oturum fixation → girişte session_regenerate_id(true); çerezler HttpOnly/Secure/SameSite", "Çerez rızası reddedilir veya verilmez → izleme çerezi kurulmaz; yalnız zorunlu oturum çerezi çalışır, rıza user_consents tablosuna kaydedilir", "Kullanıcı silme/anonimleştirme talebi → kişisel veri anonimleştirilir, anonymization_log'a kayıt düşülür (hard delete yerine)", "users.role_id geçersiz referans → FK kısıtı engeller; rol silinirken bağlı kullanıcı varsa silim reddedilir (RESTRICT)", "messages.is_read okundu/okunmadı filtresi admin listesinde; mesaj kalıcı silme yalnız Admin yetkisiyle"], "security_context": ["SQL Injection: tüm sorgular PDO prepared statement (prepare/execute); string birleştirme yasak (§5)", "XSS: tüm çıktılar htmlspecialchars($v, ENT_QUOTES, 'UTF-8') ile kaçışlanır", "CSRF: iletişim formu ve tüm admin POST işlemleri benzersiz token doğrulaması taşır", "Şifre: PASSWORD_ARGON2ID (password_hash/password_verify); md5/sha1 ve 'md5+salt' şeması yasak", "Oturum: HttpOnly, Secure, SameSite=Lax/Strict çerezler; session_regenerate_id(true) fixation koruması", "KVKK: aydınlatma metni + açık çerez rızası; kişisel veri (mesaj, IP) minimum toplama ilkesiyle tutulur", "Rol yetkilendirmesi: admin rotaları merkezi core/Auth.php require_role() kapısından geçer; yetkisiz 403, girişsiz 302 login"], "sql_draft": {"tables": ["roles", "users", "messages", "user_consents", "anonymization_log"], "seed_rows": 4, "foreign_keys": ["users.role_id -> roles.id ON DELETE RESTRICT", "user_consents.user_id -> users.id ON DELETE CASCADE", "anonymization_log.user_id -> users.id ON DELETE SET NULL"], "indexes": ["users.email UNIQUE (B-Tree)", "users.role_id FK index", "messages.is_read + created_at composite (admin liste filtresi)", "messages.email (gönderen arama)", "user_consents.user_id + consent_type composite", "anonymization_log.performed_at (denetim zamanı)"], "seed_detail": "roles: admin/moderator/user (3 satır) + users: 1 admin hesabı (PASSWORD_ARGON2ID hash) — toplam 4 seed satırı; user_consents/anonymization_log boş şema (seed değil)"}, "file_manifest": [{"path": "index.php", "purpose": "Front-controller: rota çözümleme, oturum başlatma, CSRF bootstrap"}, {"path": "core/App.php", "purpose": "Çekirdek uygulama: PDO bağlantısı, rota/yükleme, standart hata şeması"}, {"path": "core/Database.php", "purpose": "PDO prepared statement sarmalayıcı (MySQL 8.0+/MariaDB)"}, {"path": "core/Auth.php", "purpose": "Kimlik doğrulama: login/logout, ARGON2ID, require_role() rol kapısı"}, {"path": "core/Csrf.php", "purpose": "CSRF token üretimi ve doğrulaması (tüm POST istekleri)"}, {"path": "core/Message.php", "purpose": "messages modeli: form kaydı, listeleme, okundu işaretleme"}, {"path": "core/User.php", "purpose": "users/roles modeli: kullanıcı ve rol listesi (RBAC)"}, {"path": "views/home.php", "purpose": "Kurumsal ana sayfa (semantik HTML5, SEO meta)"}, {"path": "views/contact.php", "purpose": "İletişim formu görünümü (CSRF token, doğrulama mesajları)"}, {"path": "views/auth/login.php", "purpose": "Admin giriş görünümü (rate-limit, session_regenerate_id)"}, {"path": "views/admin/messages.php", "purpose": "Admin mesaj listesi (rol korumalı, okundu/okunmadı filtresi)"}, {"path": "views/admin/users.php", "purpose": "Admin kullanıcı listesi (rol korumalı)"}, {"path": "views/legal/aydinlatma.php", "purpose": "KVKK aydınlatma metni (gerçek yasal metin)"}, {"path": "views/legal/gizlilik.php", "purpose": "KVKK gizlilik politikası (gerçek yasal metin)"}, {"path": "views/legal/cerez.php", "purpose": "Çerez politikası görünümü (gerçek yasal metin)"}, {"path": "views/partials/header.php", "purpose": "Ortak üst bölüm (nav, meta, legal bağlantıları)"}, {"path": "views/partials/footer.php", "purpose": "Ortak alt bölüm"}, {"path": "views/partials/cookie-consent.php", "purpose": "Açık rıza çerez banner'ı partial'ı"}, {"path": "assets/css/style.css", "purpose": "Derlenmiş stil (mobil uyumlu, Lighthouse 90+ hedefi)"}, {"path": "assets/js/cookie-consent.js", "purpose": "Çerez rıza banner'ı davranışı (kaydet/red, tercihi kaydetme)"}, {"path": "assets/js/main.js", "purpose": "Form doğrulama/UX davranışı"}, {"path": "SQL/migrations/schema/schema.sql", "purpose": "Ana şema: roles/users/messages tabloları + FK + index"}, {"path": "SQL/migrations/schema/iletisim_kvkk.sql", "purpose": "KVKK tabloları: user_consents + anonymization_log (boş şema, seed değil)"}, {"path": "SQL/migrations/seed/seed.sql", "purpose": "Seed: 3 rol + admin kullanıcısı (PASSWORD_ARGON2ID hash)"}, {"path": "phpstan.neon", "purpose": "phpstan Level 8 yapılandırması (§8 garanti